<?xml version="1.0" encoding="ISO-8859-1" standalone="no"?> 
<!DOCTYPE MAN SYSTEM "../../man.dtd">
<MAN>
  <LANGUAGE>eng</LANGUAGE>
  <TITLE>lpf  </TITLE>
  <TYPE>Traffic-toolbox Function  </TYPE>
  <DATE>   </DATE>
  <SHORT_DESCRIPTION name="lpf ">  Travel time functions  </SHORT_DESCRIPTION>
  <CALLING_SEQUENCE>
  <CALLING_SEQUENCE_ITEM>[ta,dta,cta]=lpf(F,lpp,nf)  </CALLING_SEQUENCE_ITEM>
  </CALLING_SEQUENCE>
  <PARAM>
 <PARAM_INDENT>
  <PARAM_ITEM>
  <PARAM_NAME>F  </PARAM_NAME>
  <PARAM_DESCRIPTION>
    : row vector of flows in each arc
  </PARAM_DESCRIPTION> 
  </PARAM_ITEM>
  <PARAM_ITEM>
  <PARAM_NAME>lpp  </PARAM_NAME>
  <PARAM_DESCRIPTION>
    : parameters of the travel time functions (ttf) for each arc
  </PARAM_DESCRIPTION> 
  </PARAM_ITEM>
  <PARAM_ITEM>
  <PARAM_NAME>nf  </PARAM_NAME>
  <PARAM_DESCRIPTION>
    : model for the ttf
  </PARAM_DESCRIPTION> 
  </PARAM_ITEM>
  <PARAM_ITEM>
  <PARAM_NAME>ta  </PARAM_NAME>
  <PARAM_DESCRIPTION>
    : travel time of each arc for the given flow
  </PARAM_DESCRIPTION> 
  </PARAM_ITEM>
  <PARAM_ITEM>
  <PARAM_NAME>dta  </PARAM_NAME>
  <PARAM_DESCRIPTION>
    : derivate of the ttf for the given arc flow
  </PARAM_DESCRIPTION> 
  </PARAM_ITEM>
  <PARAM_ITEM>
  <PARAM_NAME>cta  </PARAM_NAME>
  <PARAM_DESCRIPTION>
    : integral of the ttf for the given arc flow
  </PARAM_DESCRIPTION> 
  </PARAM_ITEM>
 </PARAM_INDENT>
  </PARAM>
  <DESCRIPTION>
  <P>
    Computes the travel time of each arc for the given flow using the travel time
    functions with parameters lpp and formula nf. Each colum of lpp is of the form
    [t0;ca;ma;ba] where the coefficients t0 and ca have the meanings:
  </P>
 

  <DESCRIPTION_ITEM  label='t0'> 
    : free-flow travel time
  </DESCRIPTION_ITEM>

  <DESCRIPTION_ITEM  label='ca'> 
    : practical capacity of the link 
  </DESCRIPTION_ITEM>

  <DESCRIPTION_ITEM  label='The different formulae for the ttf are:'> 
    
  </DESCRIPTION_ITEM>

  <DESCRIPTION_ITEM  label='nf=0 -&gt; c=t0+ma/ca*F+ma*(max(0,F-ca))^ba, with ba&gt;=1'> 
  </DESCRIPTION_ITEM>

  <DESCRIPTION_ITEM  label='nf=1 -&gt; c=t0*exp((F/ca)-1), with ca&gt;0'> 
  </DESCRIPTION_ITEM>

  <DESCRIPTION_ITEM  label='nf=2 -&gt; c=t0*2^((F/ca)-1), with ca&gt;0'> 
  </DESCRIPTION_ITEM>

  <DESCRIPTION_ITEM  label='nf=3 -&gt; c=t0*(1+0.15*(F/ca)^ma), with ma&gt;=1 and ca&gt;0'> 
  </DESCRIPTION_ITEM>

  <DESCRIPTION_ITEM  label='nf=4 -&gt; c=t0+log(ca)-log(ca-F), with ca&gt;0'> 
  </DESCRIPTION_ITEM>

  <DESCRIPTION_ITEM  label='nf=5 -&gt; c=ba-ca*(t0-ba)/(F-ca), with ca&gt;0'> 
  </DESCRIPTION_ITEM>

  <DESCRIPTION_ITEM  label='nf=6 -&gt; c=t0+ca*F+ma*F^ba, with ba&gt;1'> 
    
  </DESCRIPTION_ITEM>
 
  </DESCRIPTION>
  <ITEMIZE label='EXAMPLES'>
  <VERBATIM><![CDATA[
net=TrafficExample('Small');
[g,d,lpp,nf]=Net2Par(net);
F=rand(1,9);
[ta,dta,cta]=lpf(F,lpp,nf) 
// shows the function with the different parameters
dlpf(0.1,.01,5,lpp,6);
   ]]></VERBATIM>
  </ITEMIZE>
  <SEE_ALSO>
    <SEE_ALSO_ITEM> <LINK>IntroTrfAsg</LINK> </SEE_ALSO_ITEM>     <SEE_ALSO_ITEM> <LINK>TrafficExample</LINK> </SEE_ALSO_ITEM>     <SEE_ALSO_ITEM> <LINK>dlpf</LINK> </SEE_ALSO_ITEM>
  </SEE_ALSO>
</MAN>
