<?xml version="1.0" encoding="ISO-8859-1" standalone="no"?> 
<!DOCTYPE MAN SYSTEM "../../man.dtd">
<MAN>
  <LANGUAGE>eng</LANGUAGE>
  <TITLE>AddDemands  </TITLE>
  <TYPE>Traffic-toolbox Function  </TYPE>
  <DATE>   </DATE>
  <SHORT_DESCRIPTION name="AddDemands ">  Add demands to a net list  </SHORT_DESCRIPTION>
  <CALLING_SEQUENCE>
  <CALLING_SEQUENCE_ITEM>AddDemands(td,hd,demand)  </CALLING_SEQUENCE_ITEM>
  </CALLING_SEQUENCE>
  <PARAM>
 <PARAM_INDENT>
  <PARAM_ITEM>
  <PARAM_NAME>%net  </PARAM_NAME>
  <PARAM_DESCRIPTION>
    : global variable Netlist databasis
  </PARAM_DESCRIPTION> 
  </PARAM_ITEM>
  <PARAM_ITEM>
  <PARAM_NAME>td  </PARAM_NAME>
  <PARAM_DESCRIPTION>
    : row vector, tail nodes numbers of the added demands
  </PARAM_DESCRIPTION> 
  </PARAM_ITEM>
  <PARAM_ITEM>
  <PARAM_NAME>hd  </PARAM_NAME>
  <PARAM_DESCRIPTION>
    : row vector, head nodes numbers of the added demands
  </PARAM_DESCRIPTION> 
  </PARAM_ITEM>
  <PARAM_ITEM>
  <PARAM_NAME>demand  </PARAM_NAME>
  <PARAM_DESCRIPTION>
    : row vector, the values of the added demands
  </PARAM_DESCRIPTION> 
  </PARAM_ITEM>
 </PARAM_INDENT>
  </PARAM>
  <DESCRIPTION>
  <P>
    AddDemands adds demands to a net list.
  </P>
  </DESCRIPTION>
  <ITEMIZE label='EXAMPLES'>
  <VERBATIM><![CDATA[
%net=TrafficExample('Diamond');
ShowNet()
// Add a new demand from node 3 to node 2 with value 10 in the same net
AddDemands(3,2,10);
// We can see the modifications with
ShowNet()
   ]]></VERBATIM>
  </ITEMIZE>
  <SEE_ALSO>
    <SEE_ALSO_ITEM> <LINK>IntroTrfAsg</LINK> </SEE_ALSO_ITEM>     <SEE_ALSO_ITEM> <LINK>NetList</LINK> </SEE_ALSO_ITEM>     <SEE_ALSO_ITEM> <LINK>AddLinks</LINK> </SEE_ALSO_ITEM>     <SEE_ALSO_ITEM> <LINK>AddNodes</LINK> </SEE_ALSO_ITEM>     <SEE_ALSO_ITEM> <LINK>MakeNet</LINK> </SEE_ALSO_ITEM>     <SEE_ALSO_ITEM> <LINK>ShowNet</LINK> </SEE_ALSO_ITEM>
  </SEE_ALSO>
</MAN>
