<?xml version="1.0" encoding="ISO-8859-1" standalone="no"?> 
<!DOCTYPE MAN SYSTEM "../../man.dtd">
<MAN>
  <LANGUAGE>eng</LANGUAGE>
  <TITLE>FW  </TITLE>
  <TYPE>Traffic-toolbox Function  </TYPE>
  <DATE>   </DATE>
  <SHORT_DESCRIPTION name="FW ">  Frank-Wolfe traffic assignment algorithm  </SHORT_DESCRIPTION>
  <CALLING_SEQUENCE>
  <CALLING_SEQUENCE_ITEM>[F,ta,ben]=FW(net,kmax,tol)  </CALLING_SEQUENCE_ITEM>
  </CALLING_SEQUENCE>
  <P>  </P>
  <PARAM>
 <PARAM_INDENT>
  <PARAM_ITEM>
  <PARAM_NAME>net  </PARAM_NAME>
  <PARAM_DESCRIPTION>
    : a NetList 
  </PARAM_DESCRIPTION> 
  </PARAM_ITEM>
  <PARAM_ITEM>
  <PARAM_NAME>kmax  </PARAM_NAME>
  <PARAM_DESCRIPTION>
    : maximum number of iterations
  </PARAM_DESCRIPTION> 
  </PARAM_ITEM>
  <PARAM_ITEM>
  <PARAM_NAME>tol  </PARAM_NAME>
  <PARAM_DESCRIPTION>
    : precision
  </PARAM_DESCRIPTION> 
  </PARAM_ITEM>
  <PARAM_ITEM>
  <PARAM_NAME>F  </PARAM_NAME>
  <PARAM_DESCRIPTION>
    : assigned flow 
  </PARAM_DESCRIPTION> 
  </PARAM_ITEM>
  <PARAM_ITEM>
  <PARAM_NAME>ta  </PARAM_NAME>
  <PARAM_DESCRIPTION>
    : link travel time for the assigned flow F
  </PARAM_DESCRIPTION> 
  </PARAM_ITEM>
  <PARAM_ITEM>
  <PARAM_NAME>ben  </PARAM_NAME>
  <PARAM_DESCRIPTION>
    : ni x 5 matrix (ni number of performed general iterations) benchmark information  
  </PARAM_DESCRIPTION> 
  </PARAM_ITEM>
 </PARAM_INDENT>
  </PARAM>
  <DESCRIPTION>
  <P>
    Assigns the flow with the Frank-Wolfe algorithm.
    After an initial AON assignment the link costs are updated
    and a new assignment is computed. The new assignment is combined
    with the previous one in a way that minimizes the global cost.
    The algorithm terminates when the number of iterations kmax is reached
    or the change in link costs is less than tol.
    When they are not given tol and kmax have the default values 1e-6 and
    20.
  </P>
  <P>
    The matrix ben contains intermediary informations on the
    algorithm. For each iteration it gives the iteration number, time
    spent, cost, memory used and an convergence error evaluation.
  </P>
  <P>
  </P>
  </DESCRIPTION>
  <ITEMIZE label='EXAMPLES'>
  <VERBATIM><![CDATA[
net=TrafficExample("Small");
/// generates a network with 4 nodes, 9 arcs and 2 OD-pairs
[F,ta,ben]=FW(net);
   ]]></VERBATIM>
  </ITEMIZE>
  <SEE_ALSO>
    <SEE_ALSO_ITEM> <LINK>AON</LINK> </SEE_ALSO_ITEM>     <SEE_ALSO_ITEM> <LINK>IAON</LINK> </SEE_ALSO_ITEM>     <SEE_ALSO_ITEM> <LINK>CAPRES</LINK> </SEE_ALSO_ITEM>     <SEE_ALSO_ITEM> <LINK>DSD</LINK> </SEE_ALSO_ITEM>     <SEE_ALSO_ITEM> <LINK>TrafficAssig</LINK> </SEE_ALSO_ITEM>
  </SEE_ALSO>
</MAN>
