<?xml version="1.0" encoding="ISO-8859-1" standalone="no"?> 
<!DOCTYPE MAN SYSTEM "../../../man/man.dtd">
<MAN>
  <LANGUAGE>eng</LANGUAGE>
  <TITLE>example1  </TITLE>
  <TYPE>Scilab Function  </TYPE>
  <DATE>April 1993  </DATE>
  <SHORT_DESCRIPTION name="example1"> apropos1  </SHORT_DESCRIPTION>
  <CALLING_SEQUENCE>
  <CALLING_SEQUENCE_ITEM>[X,Y]=fct(a,b,c)  </CALLING_SEQUENCE_ITEM>
  </CALLING_SEQUENCE>
  <PARAM>
 <PARAM_INDENT>
  <PARAM_ITEM>
  <PARAM_NAME>a  </PARAM_NAME>
  <PARAM_DESCRIPTION>
    : what is a
  </PARAM_DESCRIPTION> 
  </PARAM_ITEM>
  <PARAM_ITEM>
  <PARAM_NAME>b  </PARAM_NAME>
  <PARAM_DESCRIPTION>
    : what is b
  </PARAM_DESCRIPTION> 
  </PARAM_ITEM>
  <PARAM_ITEM>
  <PARAM_NAME>c  </PARAM_NAME>
  <PARAM_DESCRIPTION>
    : what is c
  </PARAM_DESCRIPTION> 
  </PARAM_ITEM>
  <PARAM_ITEM>
  <PARAM_NAME>X  </PARAM_NAME>
  <PARAM_DESCRIPTION>
    : what is X
  </PARAM_DESCRIPTION> 
  </PARAM_ITEM>
  <PARAM_ITEM>
  <PARAM_NAME>Y  </PARAM_NAME>
  <PARAM_DESCRIPTION>
    : what is Y
  </PARAM_DESCRIPTION> 
  </PARAM_ITEM>
 </PARAM_INDENT>
  </PARAM>
  <DESCRIPTION>
  <P>
    This is a blank example to show facilities for adding man pages 
  </P>
  </DESCRIPTION>
  <EXAMPLE><![CDATA[
The example
 ]]></EXAMPLE>
  <AUTHOR>Author   </AUTHOR>
  <SEE_ALSO>
    <SEE_ALSO_ITEM> <LINK>example2</LINK> </SEE_ALSO_ITEM>
  </SEE_ALSO>
</MAN>
