<?xml version="1.0" encoding="ISO-8859-1" standalone="no"?> 
<!DOCTYPE MAN SYSTEM "../../man.dtd">
<MAN>
  <LANGUAGE>eng</LANGUAGE>
  <TITLE>dlpf  </TITLE>
  <TYPE>Traffic-toolbox Function  </TYPE>
  <DATE>   </DATE>
  <SHORT_DESCRIPTION name="dlpf ">  Plot the travel time functions  </SHORT_DESCRIPTION>
  <CALLING_SEQUENCE>
  <CALLING_SEQUENCE_ITEM>c=dlpf(f0,inc,f1,lpp,nf)  </CALLING_SEQUENCE_ITEM>
  </CALLING_SEQUENCE>
  <PARAM>
 <PARAM_INDENT>
  <PARAM_ITEM>
  <PARAM_NAME>f0  </PARAM_NAME>
  <PARAM_DESCRIPTION>
    : minimal flow
  </PARAM_DESCRIPTION> 
  </PARAM_ITEM>
  <PARAM_ITEM>
  <PARAM_NAME>inc  </PARAM_NAME>
  <PARAM_DESCRIPTION>
    : increment
  </PARAM_DESCRIPTION> 
  </PARAM_ITEM>
  <PARAM_ITEM>
  <PARAM_NAME>f1  </PARAM_NAME>
  <PARAM_DESCRIPTION>
    : maximal flow
  </PARAM_DESCRIPTION> 
  </PARAM_ITEM>
  <PARAM_ITEM>
  <PARAM_NAME>lpp  </PARAM_NAME>
  <PARAM_DESCRIPTION>
    : matrix of travel time function parameters
  </PARAM_DESCRIPTION> 
  </PARAM_ITEM>
  <PARAM_ITEM>
  <PARAM_NAME>nf  </PARAM_NAME>
  <PARAM_DESCRIPTION>
    : ttf formula
  </PARAM_DESCRIPTION> 
  </PARAM_ITEM>
  <PARAM_ITEM>
  <PARAM_NAME>c  </PARAM_NAME>
  <PARAM_DESCRIPTION>
    : matrix of the computed costs 
  </PARAM_DESCRIPTION> 
  </PARAM_ITEM>
 </PARAM_INDENT>
  </PARAM>
  <DESCRIPTION>
  <P>
    Plot the travel time functions for the given parameters (lpp) between the minimal flow f0
    and the maximal flow f1 using a step of inc and the formula nf
  </P>
  <P>
  </P>
  </DESCRIPTION>
  <ITEMIZE label='EXAMPLES'>
  <VERBATIM><![CDATA[
net=TrafficExample('Small');
[g,d,lpp]=Net2Par(net);
dlpf(0.1,.01,2,lpp,6); // show the function with the different parameters
   ]]></VERBATIM>
  <P>
    
  </P>
  </ITEMIZE>
  <SEE_ALSO>
    <SEE_ALSO_ITEM> <LINK>IntroTrfAsg</LINK> </SEE_ALSO_ITEM>     <SEE_ALSO_ITEM> <LINK>TrafficExample</LINK> </SEE_ALSO_ITEM>     <SEE_ALSO_ITEM> <LINK>lpf</LINK> </SEE_ALSO_ITEM>
  </SEE_ALSO>
</MAN>
