<?xml version="1.0" encoding="ISO-8859-1" standalone="no"?> 
<!DOCTYPE MAN SYSTEM "../../man.dtd">
<MAN>
  <LANGUAGE>eng</LANGUAGE>
  <TITLE>IAON  </TITLE>
  <TYPE>Traffic-toolbox Function  </TYPE>
  <DATE>   </DATE>
  <SHORT_DESCRIPTION name="IAON ">  Iterated All or Nothing traffic assignment algorithm  </SHORT_DESCRIPTION>
  <CALLING_SEQUENCE>
  <CALLING_SEQUENCE_ITEM>[f,ta,ben]=IAON(net,k)  </CALLING_SEQUENCE_ITEM>
  </CALLING_SEQUENCE>
  <PARAM>
 <PARAM_INDENT>
  <PARAM_ITEM>
  <PARAM_NAME>net  </PARAM_NAME>
  <PARAM_DESCRIPTION>
    : a NetList
  </PARAM_DESCRIPTION> 
  </PARAM_ITEM>
  <PARAM_ITEM>
  <PARAM_NAME>k  </PARAM_NAME>
  <PARAM_DESCRIPTION>
    : number of iterations of the algorithm
  </PARAM_DESCRIPTION> 
  </PARAM_ITEM>
  <PARAM_ITEM>
  <PARAM_NAME>f  </PARAM_NAME>
  <PARAM_DESCRIPTION>
    : assigned flow (disaggregated by commodity)
  </PARAM_DESCRIPTION> 
  </PARAM_ITEM>
  <PARAM_ITEM>
  <PARAM_NAME>ta  </PARAM_NAME>
  <PARAM_DESCRIPTION>
    : row vector of reals, current time for the assigned flow
  </PARAM_DESCRIPTION> 
  </PARAM_ITEM>
  <PARAM_ITEM>
  <PARAM_NAME>ben  </PARAM_NAME>
  <PARAM_DESCRIPTION>
    : a kx5 matrix benchmark information.  
  </PARAM_DESCRIPTION> 
  </PARAM_ITEM>
 </PARAM_INDENT>
  </PARAM>
  <DESCRIPTION>
  <P>
    Assigns the flow with the Iterated All or Nothing heuristic.
    Starting with a feasible flow assigned with AON the link costs
    are calculated with the travel time functions. The AON assignment
    is made now with the computed costs and then the costs are recomputed
    for the new assignment. This process is repeated until there is
    no change in the recalculated costs or the number of iterations
    k is reached.
  </P>
  <P>
    The matrix ben contains intermediary informations on the
    algorithm. For each iteration it gives the iteration number, time
    spent, cost, memory used and an convergence error evaluation.
  </P>
  <P>
  </P>
  <P>
  </P>
  </DESCRIPTION>
  <ITEMIZE label='EXAMPLES'>
  <VERBATIM><![CDATA[
net=TrafficExample('Small');
[f,ta,ben]=IAON(net,10)
   ]]></VERBATIM>
  <P>
    
  </P>
  </ITEMIZE>
  <SEE_ALSO>
    <SEE_ALSO_ITEM> <LINK>AON</LINK> </SEE_ALSO_ITEM>     <SEE_ALSO_ITEM> <LINK>IA</LINK> </SEE_ALSO_ITEM>     <SEE_ALSO_ITEM> <LINK>FW</LINK> </SEE_ALSO_ITEM>     <SEE_ALSO_ITEM> <LINK>CAPRES</LINK> </SEE_ALSO_ITEM>     <SEE_ALSO_ITEM> <LINK>TrafficAssig</LINK> </SEE_ALSO_ITEM>
  </SEE_ALSO>
</MAN>
