<?xml version="1.0" encoding="ISO-8859-1" standalone="no"?> 
<!DOCTYPE MAN SYSTEM "../../man.dtd">
<MAN>
  <LANGUAGE>eng</LANGUAGE>
  <TITLE>MSA  </TITLE>
  <TYPE>Traffic-toolbox Function  </TYPE>
  <DATE>   </DATE>
  <SHORT_DESCRIPTION name="MSA ">  Method of successive averages  </SHORT_DESCRIPTION>
  <CALLING_SEQUENCE>
  <CALLING_SEQUENCE_ITEM>[F,ta,ben]=MSA(net,kmax,tol)  </CALLING_SEQUENCE_ITEM>
  </CALLING_SEQUENCE>
  <P>  </P>
  <PARAM>
 <PARAM_INDENT>
  <PARAM_ITEM>
  <PARAM_NAME>net  </PARAM_NAME>
  <PARAM_DESCRIPTION>
    : a NetList
  </PARAM_DESCRIPTION> 
  </PARAM_ITEM>
  <PARAM_ITEM>
  <PARAM_NAME>kmax  </PARAM_NAME>
  <PARAM_DESCRIPTION>
    : maximum number of iterations
  </PARAM_DESCRIPTION> 
  </PARAM_ITEM>
  <PARAM_ITEM>
  <PARAM_NAME>tol  </PARAM_NAME>
  <PARAM_DESCRIPTION>
    : precision
  </PARAM_DESCRIPTION> 
  </PARAM_ITEM>
  <PARAM_ITEM>
  <PARAM_NAME>F  </PARAM_NAME>
  <PARAM_DESCRIPTION>
    : assigned flow
  </PARAM_DESCRIPTION> 
  </PARAM_ITEM>
  <PARAM_ITEM>
  <PARAM_NAME>ta  </PARAM_NAME>
  <PARAM_DESCRIPTION>
    : link travel time for the assigned flow f
  </PARAM_DESCRIPTION> 
  </PARAM_ITEM>
  <PARAM_ITEM>
  <PARAM_NAME>ben  </PARAM_NAME>
  <PARAM_DESCRIPTION>
    : ni x 5 matrix (ni number of performed general iterations) benchmark information 
  </PARAM_DESCRIPTION> 
  </PARAM_ITEM>
 </PARAM_INDENT>
  </PARAM>
  <DESCRIPTION>
  <P>
    Assigns the flow with a MSA heuristic. After an initial AON
    assignment the links costs are updated and a new AON assignment is
    computed. The new flow, f^k+1=(1-lk)*f^k+lk*y^k, where lk=1/k, is computed as a
    combination of the previous flow f^k and an AON assignment y^K.
    This is repeated iteratively until iteration kmax or until the
    precision is reached.
  </P>
  <P>
    The matrix ben contains intermediary informations on the
    algorithm. For each iteration it gives the iteration number, time
    spent, cost, memory used and an convergence error evaluation.
  </P>
  <P>
  </P>
  </DESCRIPTION>
  <ITEMIZE label='EXAMPLES'>
  <VERBATIM><![CDATA[
net=TrafficExample("Steenbrink");
[f,s,ben]=MSA(net,15,1e-3);

   ]]></VERBATIM>
  </ITEMIZE>
  <SEE_ALSO>
    <SEE_ALSO_ITEM> <LINK>AON</LINK> </SEE_ALSO_ITEM>     <SEE_ALSO_ITEM> <LINK>IAON</LINK> </SEE_ALSO_ITEM>     <SEE_ALSO_ITEM> <LINK>CAPRES</LINK> </SEE_ALSO_ITEM>     <SEE_ALSO_ITEM> <LINK>FW</LINK> </SEE_ALSO_ITEM>     <SEE_ALSO_ITEM> <LINK>TrafficAssig</LINK> </SEE_ALSO_ITEM>
  </SEE_ALSO>
</MAN>
