<?xml version="1.0" encoding="ISO-8859-1" standalone="no"?> 
<!DOCTYPE MAN SYSTEM "../../man.dtd">
<MAN>
  <LANGUAGE>eng</LANGUAGE>
  <TITLE>RandomNNet  </TITLE>
  <TYPE>Traffic-toolbox Function  </TYPE>
  <DATE>   </DATE>
  <SHORT_DESCRIPTION name="RandomNNet ">  Random generation of traffic network data  </SHORT_DESCRIPTION>
  <CALLING_SEQUENCE>
  <CALLING_SEQUENCE_ITEM>net=RandomNNet(nn,mna,var,nd,nf)  </CALLING_SEQUENCE_ITEM>
  </CALLING_SEQUENCE>
  <PARAM>
 <PARAM_INDENT>
  <PARAM_ITEM>
  <PARAM_NAME>nn  </PARAM_NAME>
  <PARAM_DESCRIPTION>
    : number of nodes
  </PARAM_DESCRIPTION> 
  </PARAM_ITEM>
  <PARAM_ITEM>
  <PARAM_NAME>mna  </PARAM_NAME>
  <PARAM_DESCRIPTION>
    : mean value of the exterior degree of each node (numbers of leaving arcs)
  </PARAM_DESCRIPTION> 
  </PARAM_ITEM>
  <PARAM_ITEM>
  <PARAM_NAME>var  </PARAM_NAME>
  <PARAM_DESCRIPTION>
    : variance of the exterior degree of each node
  </PARAM_DESCRIPTION> 
  </PARAM_ITEM>
  <PARAM_ITEM>
  <PARAM_NAME>nd  </PARAM_NAME>
  <PARAM_DESCRIPTION>
    : number of OD-pairs (origin-destination)
  </PARAM_DESCRIPTION> 
  </PARAM_ITEM>
  <PARAM_ITEM>
  <PARAM_NAME>nf  </PARAM_NAME>
  <PARAM_DESCRIPTION>
    : model chosen for the computation of the travel time
  </PARAM_DESCRIPTION> 
  </PARAM_ITEM>
  <PARAM_ITEM>
  <PARAM_NAME>net  </PARAM_NAME>
  <PARAM_DESCRIPTION>
    : resulting network 
  </PARAM_DESCRIPTION> 
  </PARAM_ITEM>
 </PARAM_INDENT>
  </PARAM>
  <DESCRIPTION>
  <P>
    Generates randomly the data for the Traffic Assignment Problem. For each node an
    exterior degree is chosen randomly with a normal distribution of mean mna
    and variance var, then the successors are chosen without
    repetition. The value of nf indicates the formula chosen for the computation of
    the travel time, by default it is 6. This way of generating randomly the net if very much
    slower than RandomNet.
  </P>
  <P>
  </P>
  </DESCRIPTION>
  <ITEMIZE label='EXAMPLES'>
  <VERBATIM><![CDATA[
%net=RandomNNet(3,3,1,2);
// generates a network with 3 nodes,2 OD-pairs and form
// each node the number of leaving arcs is normally dis-
// tributed with mean 3 and var 1
ShowNet();
   ]]></VERBATIM>
  </ITEMIZE>
  <SEE_ALSO>
    <SEE_ALSO_ITEM> <LINK>IntroTrfAsg</LINK> </SEE_ALSO_ITEM>     <SEE_ALSO_ITEM> <LINK>RandomNet</LINK> </SEE_ALSO_ITEM>     <SEE_ALSO_ITEM> <LINK>Regular</LINK> </SEE_ALSO_ITEM>     <SEE_ALSO_ITEM> <LINK>NetList</LINK> </SEE_ALSO_ITEM>     <SEE_ALSO_ITEM> <LINK>ShowNet</LINK> </SEE_ALSO_ITEM>
  </SEE_ALSO>
</MAN>
