<?xml version="1.0" encoding="ISO-8859-1" standalone="no"?> 
<!DOCTYPE MAN SYSTEM "../../man.dtd">
<MAN>
  <LANGUAGE>eng</LANGUAGE>
  <TITLE>LogitN  </TITLE>
  <TYPE>CiudadSim Function  </TYPE>
  <DATE>   </DATE>
  <SHORT_DESCRIPTION name="LogitN "> Net Logit Assignment   </SHORT_DESCRIPTION>
  <CALLING_SEQUENCE>
  <CALLING_SEQUENCE_ITEM>LogitN(theta,method)  </CALLING_SEQUENCE_ITEM>
  </CALLING_SEQUENCE>
  <PARAM>
 <PARAM_INDENT>
  <PARAM_ITEM>
  <PARAM_NAME>theta  </PARAM_NAME>
  <PARAM_DESCRIPTION>
    : stochasticity parameter 
  </PARAM_DESCRIPTION> 
  </PARAM_ITEM>
  <PARAM_ITEM>
  <PARAM_NAME>method  </PARAM_NAME>
  <PARAM_DESCRIPTION>
    : macro among LogitB, LogitD, LogitMB, LogitMD
  </PARAM_DESCRIPTION> 
  </PARAM_ITEM>
  <PARAM_ITEM>
  <PARAM_NAME>%net global variable NetList  </PARAM_NAME>
  <PARAM_DESCRIPTION>
  </PARAM_DESCRIPTION> 
  </PARAM_ITEM>
 </PARAM_INDENT>
  </PARAM>
  <DESCRIPTION>
  <P>
    Compute the logit traffic assignment using a
    method among LogitB, LogitD, LogitMB, LogitMD
    the travel time is taken in %net.links.time
    and the assigned fow is put in the field
    %net.links.flow of the variable %net which
    is a NetList which must be declared global.
  </P>
  </DESCRIPTION>
  <ITEMIZE label='EXAMPLES'>
  <VERBATIM><![CDATA[
// Graph generation (the graph must be stongly connected)
%net=TrafficExample("Steenbrink");
//theta definition (almost determinsitic)
theta=10;
// Flow calculation
LogitN(theta,LogitMB)
ShowNet()
   ]]></VERBATIM>
  </ITEMIZE>
  <SEE_ALSO>
    <SEE_ALSO_ITEM> <LINK>LogitD</LINK> </SEE_ALSO_ITEM>     <SEE_ALSO_ITEM> <LINK>LogitB</LINK> </SEE_ALSO_ITEM>     <SEE_ALSO_ITEM> <LINK>LogitMB</LINK> </SEE_ALSO_ITEM>     <SEE_ALSO_ITEM> <LINK>LogitMD</LINK> </SEE_ALSO_ITEM>     <SEE_ALSO_ITEM> <LINK>LogitNE</LINK> </SEE_ALSO_ITEM>     <SEE_ALSO_ITEM> <LINK>TrafficAssig</LINK> </SEE_ALSO_ITEM>
  </SEE_ALSO>
</MAN>
