<?xml version="1.0" encoding="ISO-8859-1" standalone="no"?> 
<!DOCTYPE MAN SYSTEM "../../man.dtd">
<MAN>
  <LANGUAGE>eng</LANGUAGE>
  <TITLE>AddNodes  </TITLE>
  <TYPE>Traffic-toolbox Function  </TYPE>
  <DATE>   </DATE>
  <SHORT_DESCRIPTION name="AddNodes ">  Add nodes to a net list  </SHORT_DESCRIPTION>
  <CALLING_SEQUENCE>
  <CALLING_SEQUENCE_ITEM>AddDemands(nx,ny)  </CALLING_SEQUENCE_ITEM>
  </CALLING_SEQUENCE>
  <PARAM>
 <PARAM_INDENT>
  <PARAM_ITEM>
  <PARAM_NAME>%net  </PARAM_NAME>
  <PARAM_DESCRIPTION>
    : The global Netlist variable databasis
  </PARAM_DESCRIPTION> 
  </PARAM_ITEM>
  <PARAM_ITEM>
  <PARAM_NAME>nx  </PARAM_NAME>
  <PARAM_DESCRIPTION>
    : row vector, x coordinates of the added nodes
  </PARAM_DESCRIPTION> 
  </PARAM_ITEM>
  <PARAM_ITEM>
  <PARAM_NAME>ny  </PARAM_NAME>
  <PARAM_DESCRIPTION>
    : row vector, y coordinates of the added nodes
  </PARAM_DESCRIPTION> 
  </PARAM_ITEM>
  <PARAM_ITEM>
  <PARAM_NAME>net2  </PARAM_NAME>
  <PARAM_DESCRIPTION>
    : the resulting net list 
  </PARAM_DESCRIPTION> 
  </PARAM_ITEM>
 </PARAM_INDENT>
  </PARAM>
  <DESCRIPTION>
  <P>
    AddNodes adds nodes to a net list.
  </P>
  </DESCRIPTION>
  <ITEMIZE label='EXAMPLES'>
  <VERBATIM><![CDATA[
%net=TrafficExample('Diamond');
ShowNet()
// Add 2 new nodes with coordinates x=[346,346] and y=[559,-50]
AddNodes([346,346],[559,-50]);
// We can see the modifications with
ShowNet()
   ]]></VERBATIM>
  </ITEMIZE>
  <SEE_ALSO>
    <SEE_ALSO_ITEM> <LINK>IntroTrfAsg</LINK> </SEE_ALSO_ITEM>     <SEE_ALSO_ITEM> <LINK>NetList</LINK> </SEE_ALSO_ITEM>     <SEE_ALSO_ITEM> <LINK>AddDemands</LINK> </SEE_ALSO_ITEM>     <SEE_ALSO_ITEM> <LINK>AddLinks</LINK> </SEE_ALSO_ITEM>     <SEE_ALSO_ITEM> <LINK>MakeNet</LINK> </SEE_ALSO_ITEM>     <SEE_ALSO_ITEM> <LINK>ShowNet</LINK> </SEE_ALSO_ITEM>
  </SEE_ALSO>
</MAN>
